{
  "kind": "PermissionDecision",
  "decision_id": "<permission-decision-id>",
  "task_id": "<task-id>",
  "approval_decision_ref": "<approval decision ref>",
  "side_effect_class": "<file|git|network|release|package|secret|destructive|readback>",
  "requested_side_effects": ["<requested side effect>"],
  "approved_side_effects": ["<approved side effect>"],
  "denied_side_effects": ["<denied side effect>"],
  "approval_ceiling": {
    "side_effects": ["<maximum approved side effect>"],
    "exclusions": ["<excluded side effect>"]
  },
  "preflight": {
    "ok": false,
    "task_id": "<task-id>",
    "command": "<preflight command or readback>"
  },
  "source_refs": [
    {
      "path": "<source path>",
      "sha256": "<current source sha256>"
    }
  ],
  "lifecycle_transition": false
}
